source,text,created_at,retweet_count,favorite_count,is_retweet,id_str
Twitter for iPhone,Instead of driving jobs and wealth away AMERICA will become the world's great magnet for innovation and job creati… https://t.co/02NMQn3ZNQ,09-27-2016 01:28:04,7648,20743,FALSE,7.81E+17
Twitter Web Client,.@HillaryClinton has been part of the rigged DC system for 30 years? Why would we take policy advice from her? #Debates2016,09-27-2016 01:28:50,9794,23304,FALSE,7.81E+17
Twitter for iPhone,A Clinton economy = more taxes and more spending! #DebateNight https://t.co/oFlaAhrwe5,09-27-2016 01:32:25,8073,17073,FALSE,7.81E+17
Twitter for iPhone,HILLARY'S BAD TAX HABIT! https://t.co/x3FBy8Hdq2,09-27-2016 01:33:59,12260,22449,FALSE,7.81E+17
Twitter Web Client,This is the simple fact about @HillaryClinton: she is a typical politician - all talk no action. #Debates2016,09-27-2016 01:36:50,13362,33098,FALSE,7.81E+17
Twitter Web Client,RT @TeamTrump: WATCH: @realDonaldTrump on the stakes in this election #Debates2016 https://t.co/l7DSbPXDGh,09-27-2016 01:44:01,2021,0,TRUE,7.81E+17
Twitter Web Client,RT @TeamTrump: When @realDonaldTrump is POTUS families are going to be safe and secure. Law and order will be RESTORED! #MAGA #Debates #De…,09-27-2016 01:50:01,4780,0,TRUE,7.81E+17
Twitter Web Client,I will stand with police and protect ALL Americans! #Debates2016 #MAGA https://t.co/CX4oEWgEMp,09-27-2016 01:51:58,12512,34924,FALSE,7.81E+17
Twitter for iPhone,RT @DanScavino: Jesse Jackson on @realDonaldTrump - when he donated space for the Rainbow/Push Coalition. #DebateNight https://t.co/JTbqO0…,09-27-2016 02:10:30,5735,0,TRUE,7.81E+17
Twitter Web Client,RT @TeamTrump: Hillary's policies have made America less safe that's why 200+ general and military leaders have endorsed @realDonaldTrump!…,09-27-2016 02:19:20,5372,0,TRUE,7.81E+17
Twitter for iPhone,.@HillaryClinton's 2008 Campaign And Supporters Trafficked In Rumors About Obama's Heritage #DebateNight https://t.co/6EEOAaCiNv,09-27-2016 02:19:47,5848,12838,FALSE,7.81E+17
Twitter Web Client,Hillary Clinton is the only candidate on stage who voted for the Iraq War. #Debates2016 #MAGA https://t.co/Um5WJXEEKr,09-27-2016 02:21:59,9132,21224,FALSE,7.81E+17
Twitter for iPhone,RT @TeamTrump: 100% TRUE --&gt; @realDonaldTrump is right - @HillaryClinton did call TPP ‘the gold standard’ #Debates2016 https://t.co/W7L7a9…,09-27-2016 02:22:12,7825,0,TRUE,7.81E+17
Twitter for iPhone,Hillary Clinton failed all over the world. ❌LIBYA❌SYRIA❌IRAN❌IRAQ❌ASIA PIVOT❌RUSSIAN RESET❌BENGHAZI… https://t.co/OoakXs2rij,09-27-2016 02:26:13,22824,42749,FALSE,7.81E+17
Twitter Web Client,Russia has more warheads than ever N Korea is testing nukes and Iran got a sweetheart deal to keep theirs. Thanks @HillaryClinton.,09-27-2016 02:28:26,12247,28088,FALSE,7.81E+17
Twitter Web Client,RT @TeamTrump: .@realDonaldTrump calling out @HillaryClinton's support for NAFTA = most searched moment during tonight's debate. #Debates20…,09-27-2016 02:33:59,6335,0,TRUE,7.81E+17
Twitter for iPhone,.@HillaryClinton - Obama #ISIS Strategy Has Allowed It To Expand To Become A Global Threat #DebateNight https://t.co/f7PctDE31L,09-27-2016 02:36:11,6793,15878,FALSE,7.81E+17
Twitter Web Client,Nothing on emails. Nothing on the corrupt Clinton Foundation. And nothing on #Benghazi. #Debates2016 #debatenight,09-27-2016 02:40:26,30894,58491,FALSE,7.81E+17
Twitter for iPhone,.@HillaryClinton’s Nuclear Agreement Paved The Way For The $400 Million Ransom Payment #DebateNighthttps://t.co/qfZTx6aKYs,09-27-2016 02:42:49,8771,19969,FALSE,7.81E+17
Twitter for iPhone,Thank you Senator @TedCruz!#Debates2016 #MAGA https://t.co/cgO6109USJ,09-27-2016 03:58:24,19247,41373,FALSE,7.81E+17
Twitter for iPhone,Thank you Governor @Mike_Pence!Lets MAKE AMERICA SAFE AND GREAT AGAIN with the American people. #AmericaFirst… https://t.co/6k7qP9X8nC,09-27-2016 04:01:32,7639,23271,FALSE,7.81E+17
Twitter for iPhone,Thank you Governor @TerryBranstad! #AmericaFirst #Debates2016 https://t.co/yIeZctdQy8,09-27-2016 04:02:51,5725,15442,FALSE,7.81E+17
Twitter for Android,Wow did great in the debate polls (except for @CNN - which I don't watch). Thank you!,09-27-2016 04:34:09,12753,41193,FALSE,7.81E+17
Twitter for Android,".@newtgingrich just said ""a historic victory for Trump."" NICE!",09-27-2016 05:18:10,7919,25328,FALSE,7.81E+17
Twitter for iPhone,TIME #DebateNight poll - over 800000 votes. Thank you! #AmericaFirst #MAGA https://t.co/bTPX9E0wKu,09-27-2016 05:36:33,12642,28357,FALSE,7.81E+17
Twitter for iPhone,Thank you! CNBC #DebateNight poll with over 400000 votes. Trump 61%Clinton 39%#AmericaFirst #ImWithYou… https://t.co/MJ3NwA98op,09-27-2016 05:44:02,16943,36873,FALSE,7.81E+17
Twitter for iPhone,.@DRUDGE_REPORT's First Presidential Debate Poll:Trump: 80%Clinton: 20%Join the MOVEMENT today &amp; lets #MAGA!… https://t.co/B12lgC97tn,09-27-2016 05:54:42,11247,26303,FALSE,7.81E+17
Twitter for iPhone,Thank you! Four new #DebateNight polls with the MOVEMENT winning. Together we will MAKE AMERICA SAFE &amp; GREAT AGAIN… https://t.co/39FCnUf8Pb,09-27-2016 06:32:29,11252,25644,FALSE,7.81E+17
Twitter for Android,Great debate poll numbers - I will be on @foxandfriends at 7:00 to discuss. Enjoy!,09-27-2016 10:44:58,4773,17728,FALSE,7.81E+17
Twitter for Android,I really enjoyed the debate last night.Crooked Hillary says she is going to do so many things.Why hasn't she done them in her last 30 years?,09-27-2016 12:53:42,25687,72260,FALSE,7.81E+17
Twitter for iPhone,'How Trump won over a bar full of undecideds and Democrats'https://t.co/WWO39kxn8Y,09-27-2016 12:55:31,8404,18666,FALSE,7.81E+17
Twitter for iPhone,I won every poll from last nights Presidential Debate - except for the little watched @CNN poll.,09-27-2016 13:14:55,11271,33513,FALSE,7.81E+17
Twitter for iPhone,The #1 trend on Twitter right now is #TrumpWon - thank you!,09-27-2016 13:17:40,22047,59671,FALSE,7.81E+17
Twitter for iPhone,'True blue-collar billionaire Donald Trump shows Hillary Clinton is out of touch' https://t.co/NHO1OicfVm,09-27-2016 13:49:07,7636,17161,FALSE,7.81E+17
Twitter for iPhone,Hillary's been failing for 30 years in not getting the job done - it will never change.,09-27-2016 14:49:09,15853,39767,FALSE,7.81E+17
Twitter for iPhone,Thank you! #TrumpWon #MAGA https://t.co/a5rr1i38km,09-27-2016 14:51:25,9064,20634,FALSE,7.81E+17
Twitter for iPhone,'U.S. Murders Increased 10.8% in 2015' via @WSJ: https://t.co/CIJMQJhLqp,09-27-2016 14:55:57,7421,13475,FALSE,7.81E+17
Twitter for iPhone,Such a great honor. Final debate polls are in - and the MOVEMENT wins!#AmericaFirst #MAGA #ImWithYou… https://t.co/DV1BKMwHEM,09-27-2016 15:47:29,17467,34483,FALSE,7.81E+17
Twitter for iPhone,Thank you for your endorsement @GovernorSununu. #MAGA https://t.co/8BEeQPsuyd,09-27-2016 16:58:58,6093,16990,FALSE,7.81E+17
Twitter for Android,Well now they're saying that I not only won the NBC Presidential Forum but last night the big debate. Nice!,09-27-2016 17:47:36,11413,36631,FALSE,7.81E+17
Twitter for iPhone,In the last 24 hrs. we have raised over $13M from online donations and National Call Day and we’re still going! Thank you America! #MAGA,09-27-2016 19:37:22,10924,36621,FALSE,7.81E+17
Twitter for iPhone,Great afternoon in Little Havana with Hispanic community leaders. Thank you for your support! #ImWithYou https://t.co/vxWZ2tyJTF,09-27-2016 19:59:04,8900,24333,FALSE,7.81E+17
Twitter for iPhone,'CNBC Time magazine online polls say Donald Trump won the first presidential debate' via @WashTimes. #MAGAhttps://t.co/PGimqYKPoJ,09-27-2016 20:06:25,7596,18488,FALSE,7.81E+17
Twitter for iPhone,Hillary Clinton's Campaign Continues To Make False Claims About Foundation Disclosure: https://t.co/zhkEfUouHH,09-27-2016 20:14:33,7269,16722,FALSE,7.81E+17
Twitter for iPhone,RT @GOP: On National #VoterRegistrationDay make sure you're registered to vote so we can #MakeAmericaGreatAgain https://t.co/GKcaLkx8C8 ht…,09-27-2016 20:31:14,5920,0,TRUE,7.81E+17
Twitter for iPhone,Once again we will have a government of by and for the people. Join the MOVEMENT today! https://t.co/lWjYDbPHav https://t.co/uYwJrtZkAe,09-27-2016 21:08:22,9588,23182,FALSE,7.81E+17
Twitter for iPhone,Join me for a 3pm rally - tomorrow at the Mid-America Center in Council Bluffs Iowa! Tickets:… https://t.co/dfzsbICiXc,09-27-2016 22:13:24,5569,15216,FALSE,7.81E+17
Twitter for iPhone,Unbelievable evening in Melbourne Florida w/ 15000 supporters- and an additional 12000 who could not get in. Tha… https://t.co/VU5wh2zXBU,09-28-2016 01:03:03,16530,45152,FALSE,7.81E+17
Twitter for iPhone,My supporters are the best! $18 million from hard-working people who KNOW what we can be again! Shatter the record: https://t.co/8ZHGyOth0f,09-28-2016 02:17:06,9999,29700,FALSE,7.81E+17
Twitter for Android,Every on-line poll Time Magazine Drudge etc. has me winning the debate. Thank you to Fox &amp; Friends for so reporting!,09-28-2016 12:41:03,11022,38463,FALSE,7.81E+17
Twitter for iPhone,Join me in Council Bluffs Iowa- today at 3pm! #MakeAmericaGreatAgain Tickets: https://t.co/iRL3xh37gF,09-28-2016 16:20:01,4452,12353,FALSE,7.81E+17
Twitter for iPhone,Melania and I extend our deepest condolences to the family of Shimon Peres...https://t.co/xeGYL2IzUP,09-28-2016 17:26:26,6458,18104,FALSE,7.81E+17
Twitter for iPhone,An honor to meet with the Polish American Congress in Chicago this morning! #ImWithYou Video:… https://t.co/lBFHoWRqox,09-28-2016 17:40:10,7224,18333,FALSE,7.81E+17
Twitter for iPhone,"RT @TeamTrump: ""She put the office of Sec of State up for sale. If she ever got the chance she’d put the Oval Office up for sale too."" #Fo…",09-28-2016 21:42:43,10034,0,TRUE,7.81E+17
Twitter for iPhone,Thank you Council Bluffs Iowa! Will be back soon. Remember- everything you need to know about Hillary -- just… https://t.co/45kIHxdX83,09-28-2016 22:54:59,8639,21168,FALSE,7.81E+17
Twitter for iPhone,Join me live in Waukesha Wisconsin for an 8pmE rally! #AmericaFirst #MAGAhttps://t.co/G8kGLSFy6S,09-28-2016 23:54:08,3825,11772,FALSE,7.81E+17
Twitter for iPhone,Joining @oreillyfactor from Waukesha Wisconsin - now live! Enjoy!,09-29-2016 00:01:35,4266,15139,FALSE,7.81E+17
Twitter for iPhone,Thank you Waukesha Wisconsin! Full transcript of my speech #FollowTheMoney:https://t.co/Xb1yyDSNNf https://t.co/WdKK6nJCZW,09-29-2016 02:51:57,6675,16991,FALSE,7.81E+17
Twitter for iPhone,Join me in Bedford New Hampshire- tomorrow at 3:00pm. Can't wait to see everyone! #AmericaFirst #MAGA… https://t.co/oeOJFAS7it,09-29-2016 03:23:07,6539,16674,FALSE,7.81E+17
Twitter for iPhone,Will be in Novi Michigan this Friday at 5:00pm. Join the MOVEMENT! Tickets available at: https://t.co/Q6APf0ZFYA… https://t.co/6WAyO9eQHN,09-29-2016 03:42:03,7142,17021,FALSE,7.81E+17
Twitter Web Client,My condolences to those involved in today's horrible accident in NJ and my deepest gratitude to all of the amazing first responders.,09-29-2016 18:05:56,11177,39180,FALSE,7.82E+17
Twitter for iPhone,Join me in Manheim Pennsylvania on Saturday at 7pm! #TrumpRallyTickets: https://t.co/ADOGW34ctF https://t.co/LNWQZ9yUJy,09-29-2016 19:16:40,7049,16672,FALSE,7.82E+17
Twitter for iPhone,Thank you for joining me this afternoon New Hampshire! Will be back soon. #FollowTheMoneySpeech transcript:… https://t.co/VtUkDgF4vs,09-29-2016 21:34:57,6463,17431,FALSE,7.82E+17
Twitter for iPhone,While Hillary profits off the rigged system I am fighting for you! Remember the simple phrase: #FollowTheMoney… https://t.co/8mVInc82E9,09-29-2016 22:17:55,16973,31164,FALSE,7.82E+17
Twitter for Android,Wow did you see how badly @CNN (Clinton News Network) is doing in the ratings. With people like @donlemon who could expect any more?,09-30-2016 02:16:00,13744,38458,FALSE,7.82E+17
Twitter for Android,"Anytime you see a story about me or my campaign saying ""sources said"" DO NOT believe it. There are no sources they are just made up lies!",09-30-2016 07:20:02,18725,46163,FALSE,7.82E+17
Twitter for Android,"Wow Crooked Hillary was duped and used by my worst Miss U. Hillary floated her as an ""angel"" without checking her past which is terrible!",09-30-2016 09:14:03,11075,29411,FALSE,7.82E+17
Twitter for Android,Using Alicia M in the debate as a paragon of virtue just shows that Crooked Hillary suffers from BAD JUDGEMENT! Hillary was set up by a con.,09-30-2016 09:19:25,11510,29597,FALSE,7.82E+17
Twitter for Android,Did Crooked Hillary help disgusting (check out sex tape and past) Alicia M become a U.S. citizen so she could use her in the debate?,09-30-2016 09:30:11,17815,35492,FALSE,7.82E+17
Twitter for Android,"Remember don't believe ""sources said"" by the VERY dishonest media. If they don't name the sources the sources don't exist.",09-30-2016 12:50:48,17046,39382,FALSE,7.82E+17
Twitter for iPhone,The people are really smart in cancelling subscriptions to the Dallas &amp; Arizona papers &amp; now USA Today will lose readers! The people get it!,09-30-2016 14:21:54,13814,38452,FALSE,7.82E+17
Twitter for iPhone,Why isn't Hillary 50 points ahead? Maybe it's the email scandal policies that spread ISIS or calling millions of… https://t.co/yKz9vCz8O1,09-30-2016 18:24:21,26120,54098,FALSE,7.82E+17
Twitter for Android,For those few people knocking me for tweeting at three o'clock in the morning at least you know I will be there awake to answer the call!,09-30-2016 18:37:48,40850,107497,FALSE,7.82E+17
Twitter for iPhone,Join me in Pueblo Colorado on Monday afternoon at 3pm! #TrumpRallyhttps://t.co/3P3QZxzSPJ,09-30-2016 20:03:41,5779,14186,FALSE,7.82E+17
Twitter for iPhone,Thank you for your support - on my way now! See you soon. #TrumpTrain https://t.co/SYuRpzosb5,09-30-2016 20:10:54,8352,21320,FALSE,7.82E+17
Twitter for iPhone,Thank you Novi Michigan! Get out and VOTE #TrumpPence16 on 11/8. Together WE WILL MAKE AMERICA GREAT AGAIN!… https://t.co/n7Gd6Xc18H,09-30-2016 23:01:50,10347,25323,FALSE,7.82E+17
Twitter for iPhone,I believe in #AmericaFirst and that means FAMILY FIRST! My childcare plan reflects the needs of modern working-clas… https://t.co/RCnZZtTk4c,10/01/2016 00:52,17291,40277,FALSE,7.82E+17
Twitter for iPhone,Crooked H is nasty to Sanders supporters behind closed doors. Owned by Wall St and Politicians HRC is not with you. https://t.co/WN1lyCDXla,10/01/2016 17:01,16300,30793,FALSE,7.82E+17
Twitter for Android,"I won the debate if you decide without watching the totally one-sided ""spin"" that followed. This despite the really bad microphone.",10/01/2016 20:16,10657,36480,FALSE,7.82E+17
Twitter for Android,The so-called Commission on Presidential Debates admitted to us that the DJT audio &amp; sound level was very bad. So why didn't they fix it?,10/01/2016 20:47,10490,28700,FALSE,7.82E+17
Twitter for Android,Wow just saw the really bad @CNN ratings. People don't want to watch bad product that only builds up Crooked Hillary.,10/01/2016 21:25,10920,31493,FALSE,7.82E+17
Twitter for Android,Heading to Pennsylvania for a big rally tonight. We will MAKE AMERICA GREAT AGAIN!,10/01/2016 21:29,8929,30580,FALSE,7.82E+17
Twitter for Android,I know our complex tax laws better than anyone who has ever run for president and am the only one who can fix them. #failing@nytimes,10/02/2016 11:22,15421,41385,FALSE,7.83E+17
Twitter for Android,I have created tens of thousands of jobs and will bring back great American prosperity. Hillary has only created jobs at the FBI and DOJ!,10/02/2016 11:35,19176,51117,FALSE,7.83E+17
Twitter for iPhone,Bernie should pull his endorsement of Crooked Hillary after she decieved him and then attacked him and his supporters.,10/02/2016 21:48,16494,44246,FALSE,7.83E+17
Twitter for iPhone,Melania and I extend our warmest greetings to those observing Rosh Hashanah here in the United States in Israel and around the world.,10/02/2016 21:59,12069,38384,FALSE,7.83E+17
Twitter for Android,Just announced that Iraq (U.S.) is preparing for battle to reclaim Mosul. Why do they have to announce this? Makes mission much harder!,10/02/2016 23:45,13854,38012,FALSE,7.83E+17
Twitter for iPhone,Join me in Henderson Nevada on Wednesday at 11:30am! #MAGA Tickets: https://t.co/pWTYv9BbUE,10/03/2016 14:10,5969,14787,FALSE,7.83E+17
Twitter for iPhone,Thank you Pueblo Colorado! #TrumpRally #AmericaFirsthttps://t.co/3KWOl20zMm https://t.co/rFAf7xYNhy,10/03/2016 21:41,6434,16025,FALSE,7.83E+17
Twitter for iPhone,We must bring the truth directly to hard-working Americans who want to take our country back. #BigLeagueTruth… https://t.co/0iAeiPYEhO,10/03/2016 22:03,11533,25124,FALSE,7.83E+17
Twitter for iPhone,Thank you Colorado! #MAGAhttps://t.co/3KWOl20zMmhttps://t.co/M7QhdCgRzw https://t.co/wIGNtKPA2X,10/04/2016 02:20,8955,22251,FALSE,7.83E+17
Twitter for iPhone,Join me in Reno Nevada on Wednesday at 3:30pm at the Reno-Sparks Convention Center! #MAGATickets:… https://t.co/G0NvFLQWgS,10/04/2016 03:39,6603,15621,FALSE,7.83E+17
Twitter for iPhone,Join me in Reno Nevada tomorrow at 3:30pm! #AmericaFirst #MAGATickets: https://t.co/DJ7JJUkkz7,10/04/2016 19:36,3203,9421,FALSE,7.83E+17
Twitter for iPhone,I will be watching the great Governor @Mike_Pence and live tweeting the VP debate tonight starting at 8:30pm est! Enjoy!,10/04/2016 19:40,7201,24813,FALSE,7.83E+17
Twitter for iPhone,My childcare plan makes a difference for working families - more money more freedom. #AmericaFirst means… https://t.co/X3Yn3FZphf,10/04/2016 19:48,9198,22836,FALSE,7.83E+17
Twitter for iPhone,Thank you ARIZONA! This is a MOVEMENT like nobody has ever seen before. Together we are going to MAKE AMERICA SAFE… https://t.co/EwP4hnaeoE,10/04/2016 22:38,6624,18728,FALSE,7.83E+17
Twitter for iPhone,Join the MOVEMENT!https://t.co/3KWOl20zMm https://t.co/BS5JLelPJd,10/04/2016 23:44,5370,13538,FALSE,7.83E+17
Twitter for Android,Wow did you just hear Bill Clinton's statement on how bad ObamaCare is. Hillary not happy. As I have been saying REPEAL AND REPLACE!,10/04/2016 23:55,11364,32866,FALSE,7.83E+17
Twitter for Android,Wow @CNN is so negative. Their panel is a joke biased and very dumb. I'm turning to @FoxNews where we get a fair shake! Mike will do great,10/05/2016 00:12,8066,33537,FALSE,7.83E+17
Twitter for Android,I will be live-tweeting the V.P. Debate. Very exciting! MAKE AMERICA GREAT AGAIN!,10/05/2016 00:18,5217,20153,FALSE,7.83E+17
Twitter for Android,Here we go - Enjoy!,10/05/2016 01:01,4002,17172,FALSE,7.83E+17
Twitter for Android,Both are looking good! Now we begin!,10/05/2016 01:05,2133,11146,FALSE,7.83E+17
Twitter for iPhone,.@megynkelly- I am in Nevada. Sorry to inform you Kellyanne is in the audience. Better luck next time.,10/05/2016 01:06,3603,14060,FALSE,7.83E+17
Twitter for iPhone,RT @joshrogin: Pence is right. Clinton &amp; Obama tried to negotiate an Iraq troop extension but failed. Bush admin always anticipated such an…,10/05/2016 01:21,5474,0,TRUE,7.83E+17
Twitter for iPhone,RT @mike_pence: There’s one clear choice in this election to create jobs and grow the American economy. #VPDebate https://t.co/cvv0cK6Fbt,10/05/2016 01:21,12631,0,TRUE,7.83E+17
Twitter for iPhone,RT @TeamTrump: .@timkaine has a pay-to-play problem just like Crooked @HillaryClinton #VPDebates #BigLeagueTruth https://t.co/SPOIn8AN8m,10/05/2016 01:24,9971,0,TRUE,7.83E+17
Twitter for Android,.@mike_pence is doing a great job - so far no contest!,10/05/2016 01:30,10718,42786,FALSE,7.83E+17
Twitter for iPhone,.@timkaine oversaw unemployment INCREASE by 179249 while @mike_pence DECREASED unemployment in Indiana by 113826.… https://t.co/wFQM8kg287,10/05/2016 01:35,9869,21131,FALSE,7.83E+17
Twitter for iPhone,RT @seanspicer: .@timkaine wants to tough on crime - fails to talk about defending rapists and murders #VPDebate,10/05/2016 01:36,3597,0,TRUE,7.83E+17
Twitter for iPhone,RT @TeamTrump: Law enforcement officers bring communities together &amp; keep us safe. @mike_pence &amp; @realDonaldTrump RESPECT &amp; stand by them!…,10/05/2016 01:37,8593,0,TRUE,7.83E+17
Twitter for iPhone,"RT @TeamTrump: “Police officers are the BEST of us. Law enforcement in this country is a force for GOOD."" - @mike_pence #VPDebate #BigLeagu…",10/05/2016 01:40,5910,0,TRUE,7.83E+17
Twitter for iPhone,.@HillaryClinton Sneers At Millions Of Average Americans.https://t.co/gEfURjRCfu #VPDebate #BigLeagueTruth,10/05/2016 01:46,6261,17113,FALSE,7.83E+17
Twitter for iPhone,"I agree Mike - thank you to all of our law enforcement officers! #VPDebate ""Police officers are the best of us...""@Mike_Pence",10/05/2016 01:50,11000,36902,FALSE,7.83E+17
Twitter for iPhone,WHAT THEY ARE SAYING ABOUT MIKE PENCE “DOMINATING” THE DEBATE:https://t.co/mUw9S5GgNM #VPDebate,10/05/2016 01:52,6835,21946,FALSE,7.83E+17
Twitter for iPhone,.@mike_pence and I will defeat #ISIS.https://t.co/oCIIDwtptV #VPDebate,10/05/2016 01:54,6092,21084,FALSE,7.83E+17
Twitter for iPhone,RT @GOP: In @timkaine's own words ⬇️ #Debates2016 https://t.co/PMngoKHUjA,10/05/2016 01:54,8305,0,TRUE,7.83E+17
Twitter for iPhone,CLINTON’S FLAILING SYRIA POLICY WAS JUDGED A FAILURE:https://t.co/ICZxn7Q3vZ #VPDebate,10/05/2016 02:05,6222,17300,FALSE,7.83E+17
Twitter for iPhone,RT @TeamTrump: We need STRONG BROAD-SHOULDERED leadership like @mike_pence &amp; @realDonaldTrump in the White House! #VPDebate #BigLeagueTrut…,10/05/2016 02:06,7031,0,TRUE,7.83E+17
Twitter for iPhone,.@timkaine is the ANTI-DEFENSE SENATOR. #VPDebate #BigLeagueTruth https://t.co/qWkvGFARA1,10/05/2016 02:09,7067,15320,FALSE,7.83E+17
Twitter for iPhone,ICYMI: PENCE: I RAN A STATE THAT WORKED; KAINE RAN A STATE THAT FAILED. https://t.co/XuWaueNkH0,10/05/2016 02:12,8819,22875,FALSE,7.83E+17
Twitter for iPhone,.@timkaine is wrong for defense: https://t.co/QN9qqoq1kH #BigLeagueTruth #VPDebate,10/05/2016 02:13,5312,15217,FALSE,7.83E+17
Twitter for iPhone,Sanctions Relief From Clinton-Obama Iran Nuclear Deal Likely Go to Terrorists:https://t.co/lM80JriF9k #BigLeagueTruth #VPDebate,10/05/2016 02:15,6228,15247,FALSE,7.83E+17
Twitter for iPhone,CLINTON’S CLOSE TIES TO PUTIN DESERVE SCRUTINY:https://t.co/wPYm5vQoyt #VPDebate,10/05/2016 02:16,10702,19967,FALSE,7.83E+17
Twitter for iPhone,RT @TeamTrump: .@HillaryClinton &amp; @timkaine think you're #Deplorables &amp; #BasementDwellers. @realDonaldTrump &amp; @mike_pence think you're PATR…,10/05/2016 02:17,7050,0,TRUE,7.83E+17
Twitter for iPhone,RT @TeamTrump: Obama-Clinton FAILED foreign policy:-Bad nuclear deal-Ransom payment to leading state sponsor of terror-Sharing classifie…,10/05/2016 02:17,6022,0,TRUE,7.83E+17
Twitter for iPhone,CLINTON IS WEAK ON NORTH KOREA:https://t.co/8pRednmnFX #VPDebate,10/05/2016 02:19,6337,18588,FALSE,7.83E+17
Twitter for iPhone,.@HillaryClinton’s Careless Use Of A Secret Server Put National Security At Risk: https://t.co/OiAEMnrGcy #VPDebate#BigLeagueTruth,10/05/2016 02:22,8888,22717,FALSE,7.83E+17
Twitter for iPhone,Clinton’s Top Aides Were Mired In Conflict Of Interest At The State Department: https://t.co/wWfdaECtVu#VPDebate #BigLeagueTruth,10/05/2016 02:26,6598,16888,FALSE,7.83E+17
Twitter for iPhone,RT @TeamTrump: .@timkaine's Abortion Flip-Flops: From Valuing The Sanctity of Life --&gt; Pro-Abortion Demagogue #VPdebate https://t.co/aK4061…,10/05/2016 02:30,5890,0,TRUE,7.83E+17
Twitter for iPhone,RT @TeamTrump: RT if you agree - @HillaryClinton &amp; @timkaine are WRONG for America! #VPDebate #MAGA https://t.co/2MZfFzCo6c,10/05/2016 02:31,15259,0,TRUE,7.83E+17
Twitter for iPhone,RT @mike_pence: History teaches us that weakness arouses evil. America needs to be strong on the world stage. #VPDebate https://t.co/FJ59o5…,10/05/2016 02:32,13311,0,TRUE,7.83E+17
Twitter for Android,Mike Pence won big. We should all be proud of Mike!,10/05/2016 02:36,35765,120189,FALSE,7.83E+17
Twitter for Android,The constant interruptions last night by Tim Kaine should not have been allowed. Mike Pence won big!,10/05/2016 13:28,13279,49008,FALSE,7.84E+17
Twitter for iPhone,Beautiful morning- thank you @ICLV! https://t.co/xzJhrLgjHP,10/05/2016 18:40,7510,19359,FALSE,7.84E+17
Twitter for iPhone,About to begin a rally here in Henderson Nevada. New Reuters poll just out- thank you! Join the MOVEMENT:… https://t.co/uvbntNsxGl,10/05/2016 18:53,6131,15560,FALSE,7.84E+17
Twitter for iPhone,Thank you Henderson NV. This is a MOVEMENT like never seen before! Watch some of the rally via my Facebook page:… https://t.co/dNF8G4VUqY,10/05/2016 21:11,5977,15310,FALSE,7.84E+17
Twitter for iPhone,Bill Clinton is right: Obamacare is 'crazy' 'doesn't work' and 'doesn't make sense'.  Thanks Bill for telling the truth.,10/05/2016 21:19,16413,40883,FALSE,7.84E+17
Twitter for iPhone,Thank you @SenJohnMcCain for your kind remarks on the important issue of PTSD and the dishonest media. Great to be in Arizona yesterday!,10/05/2016 21:22,10650,30232,FALSE,7.84E+17
Twitter for iPhone,'Small business says Trump is their pick for president'https://t.co/tzVN9QgPFS,10/05/2016 22:02,9753,22664,FALSE,7.84E+17
Twitter for iPhone,EARLY VOTING: MN &amp; IA already underway more states coming up in the next week: OH ME AZ IN — check w/local officials for details &amp; VOTE!,10/05/2016 22:57,8087,19307,FALSE,7.84E+17
Twitter for iPhone,Thank you South Carolina! Everyone has to get out and VOTE on 11/8/16. #MakeAmericaGreatAgain… https://t.co/os7EmRCdPf,10/05/2016 22:59,7014,17376,FALSE,7.84E+17
Twitter for iPhone,Reuters polling just out- thank you!#MakeAmericaGreatAgain https://t.co/UMY6kOiSTu,10/05/2016 23:19,13497,29379,FALSE,7.84E+17
Twitter for iPhone,Amazing rally in Reno Nevada- thank you. Make sure you get out on 11/8 &amp; VOTE #TrumpPence16. Together we will put… https://t.co/6gPJhb29xk,10/06/2016 01:15,7044,18810,FALSE,7.84E+17
Twitter for iPhone,Such a great honor! https://t.co/vt4AmLdkeP,10/06/2016 01:32,8845,20159,FALSE,7.84E+17
