source,text,created_at,retweet_count,favorite_count,is_retweet,id_str
Twitter for Android,Really bad shooting in Orlando. Police investigating possible terrorism. Many people dead and wounded.,06/12/2016 12:07,9368,26676,FALSE,7.42E+17
Twitter for iPhone,Clinton made a false ad about me where I was imitating a reporter GROVELING after he changed his story. I would NEVER mock disabled. Shame!,06/12/2016 13:39,7321,27604,FALSE,7.42E+17
Twitter for iPhone,Horrific incident in FL. Praying for all the victims &amp; their families. When will this stop? When will we get tough smart &amp; vigilant?,06/12/2016 15:45,29750,79313,FALSE,7.42E+17
Twitter for iPhone,Appreciate the congrats for being right on radical Islamic terrorism I don't want congrats I want toughness &amp; vigilance. We must be smart!,06/12/2016 16:43,27146,73417,FALSE,7.42E+17
Twitter for iPhone,Is President Obama going to finally mention the words radical Islamic terrorism? If he doesn't he should immediately resign in disgrace!,06/12/2016 17:58,38456,91642,FALSE,7.42E+17
Twitter for Android,"Reporting that Orlando killer shouted ""Allah hu Akbar!"" as he slaughtered clubgoers. 2nd man arrested in LA with rifles near Gay parade.",06/12/2016 18:52,16520,34881,FALSE,7.42E+17
Twitter for Android,What has happened in Orlando is just the beginning. Our leadership is weak and ineffective. I called it and asked for the ban. Must be tough,06/12/2016 20:47,27815,72994,FALSE,7.42E+17
Twitter for Android,I have been hitting Obama and Crooked Hillary hard on not using the term Radical Islamic Terror. Hillary just broke-said she would now use!,06-13-2016 14:59:25,9649,32378,FALSE,7.42E+17
Twitter for Android,I will be going to New Hampshire today home of my first primary victory to discuss terror and the horrible events of yesterday. 2:30 P.M.,06-13-2016 15:03:29,4487,17238,FALSE,7.42E+17
Twitter for Android,I am watching @FoxNews and how fairly they are treating me and my words and @CNN and the total distortion of my words and what I am saying,06-13-2016 15:08:20,7865,26737,FALSE,7.42E+17
Twitter for iPhone,Congratulations to the 2016 #StanleyCup Champions Pittsburgh @Penguins!,06-13-2016 18:08:38,7316,22112,FALSE,7.42E+17
Twitter for iPhone,TERRORISM IMMIGRATION AND NATIONAL SECURITY SPEECH- TRANSCRIPT: https://t.co/WD1LGFKx3M https://t.co/T7yHSdCeU8,06-13-2016 19:26:07,7746,17278,FALSE,7.42E+17
Twitter for iPhone,RT @AnnCoulter: Anyone who plans to talk about Trump ever again has to see this speech.  Your opinion is irrelevant unless you listened to…,06-13-2016 19:43:54,8436,0,TRUE,7.42E+17
Twitter for iPhone,I am no fan of President Obama but to show you how dishonest the phony Washington Post is: https://t.co/cITm8BPixD,06-13-2016 20:35:11,4028,11732,FALSE,7.42E+17
Twitter for iPhone,Based on the incredibly inaccurate coverage and reporting of the record setting Trump campaign we are hereby:  https://t.co/THKJwjNkaz,06-13-2016 20:38:59,4493,13214,FALSE,7.42E+17
Twitter for iPhone,In my speech on protecting America I spoke about a temporary ban which includes suspending immigration from nations tied to Islamic terror.,06-13-2016 21:10:26,13026,38669,FALSE,7.42E+17
Twitter for iPhone,I thought people weren’t celebrating? They were cheering all over even this savage from Orlando. I was right. https://t.co/DrVa65X9rI,06-13-2016 21:12:21,9599,20139,FALSE,7.42E+17
Twitter for iPhone,Saudi Arabia and many of the countries that gave vast amounts of money to the Clinton Foundation- cont'd: https://t.co/t31ReRSzzy,06-13-2016 21:32:44,6969,14923,FALSE,7.42E+17
Twitter for iPhone,Crooked Hillary says we must call on Saudi Arabia and other countries to stop funding hate. I am calling on- cont'd: https://t.co/T1fVcu3mEC,06-13-2016 21:35:30,6116,15521,FALSE,7.42E+17
Twitter for iPhone,Join me in Atlanta on Wednesday- at noon! #Trump2016Tickets: https://t.co/1JJ2Kn0ani https://t.co/cyARlHSEFU,06-14-2016 00:20:57,4145,12393,FALSE,7.43E+17
Twitter for Android,American must now get very tough very smart and very vigilant. We cannot admit people into our country without extraordinary screening.,06-14-2016 12:26:49,14858,43313,FALSE,7.43E+17
Twitter for Android,AMERICA FIRST!,06-14-2016 12:28:16,20653,47998,FALSE,7.43E+17
Twitter Web Client,Thank you to the LGBT community! I will fight for you while Hillary brings in more people that will threaten your freedoms and beliefs.,06-14-2016 17:31:58,18387,52036,FALSE,7.43E+17
Twitter for iPhone,HAPPY 241st BIRTHDAY to the @USArmy! THANK YOU! https://t.co/mXsxkfcstC,06-14-2016 18:09:57,10194,35724,FALSE,7.43E+17
Twitter for iPhone,RT @realDonaldTrump: HAPPY 241st BIRTHDAY to the @USArmy! THANK YOU! https://t.co/mXsxkfcstC,06-14-2016 18:10:18,10194,0,TRUE,7.43E+17
Twitter for iPhone,TONIGHT! NORTH CAROLINA:https://t.co/UolRS3aT6WWEDNESDAY! GEORGIA:https://t.co/1JJ2Kn0aniSATURDAY! NEVADA:https://t.co/x3w1PHtLXP,06-14-2016 18:28:48,3292,9585,FALSE,7.43E+17
Twitter for iPhone,Thank you Greensboro North Carolina! Will be back soon! #AmericaFirst https://t.co/R29WMGNLGG,06-15-2016 02:40:32,4953,18006,FALSE,7.43E+17
Twitter for Android,"An: Media fell all over themselves criticizing what DonaldTrump ""may have insinuated about @POTUS."" But he's right: https://t.co/bIIdYtvZYw",06-15-2016 13:38:17,7854,14360,FALSE,7.43E+17
Twitter for Android,The press is so totally biased that we have no choice but to take our tough but fair and smart message directly to the people!,06-15-2016 13:44:14,8792,27252,FALSE,7.43E+17
Twitter for Android,I will be meeting with the NRA who has endorsed me about not allowing people on the terrorist watch list or the no fly list to buy guns.,06-15-2016 13:50:31,13903,47412,FALSE,7.43E+17
Twitter for iPhone,Thank you Atlanta Georgia! Will be back soon! #AmericaFirst https://t.co/cVJvfcoGOt,06-15-2016 20:04:47,3713,14324,FALSE,7.43E+17
Twitter for iPhone,Join me in Dallas Texas on Thursday!#AmericaFirst #Trump2016 https://t.co/fX0kXZUNqz https://t.co/c7sCbHDAQh,06-15-2016 20:52:45,4416,12538,FALSE,7.43E+17
Twitter for iPhone,Finally an accurate story from the Washington Post!https://t.co/0nNKEBSd73,06-15-2016 21:25:14,3599,10747,FALSE,7.43E+17
Twitter for Android,I will be interviewed on @greta at 7:00 P.M.  @FoxNews,06-15-2016 22:49:53,2019,9110,FALSE,7.43E+17
Twitter for iPhone,RT @AnnCoulter: Trump's speech today was Churchillian only better.  You can tell by the spluttering hysteria on TV about @realDonaldTrump.,06-15-2016 22:57:49,5093,0,TRUE,7.43E+17
Twitter for iPhone,McAllen Texas- 8 miles from U.S. - Mexico border. #Trump2016 Video: https://t.co/pQ4nSTnVrK https://t.co/dKBTP1QjH3,06-16-2016 16:50:00,3648,9294,FALSE,7.43E+17
Twitter for iPhone,The trade deficit rose to a 7yr high thanks to horrible trade policies Clinton supports. I will fix it fast- JOBS! https://t.co/jaGeN4u50U,06-16-2016 16:54:39,5052,13024,FALSE,7.43E+17
Twitter for iPhone,Donald Trumps Speech Is a Game Changer. https://t.co/VXjtSivvuU https://t.co/J777QHdYa3,06-16-2016 16:59:00,4748,13728,FALSE,7.43E+17
Twitter for iPhone,RT @Reince: Flying to Dallas now with @realDonaldTrump...Reports of discord are pure fiction. Great events lined up all over Texas.  Rs wil…,06-16-2016 19:07:45,6333,0,TRUE,7.44E+17
Twitter for iPhone,Join me in Houston Texas tomorrow night at 7pm! Tickets: https://t.co/nvHRnfzEbH https://t.co/Yd3f8xLpPl,06-16-2016 19:16:23,3418,10055,FALSE,7.44E+17
Twitter for iPhone,Houston TX:https://t.co/nvHRnfi2N7Las Vegas NVhttps://t.co/ksU8AGrFBSPhoenix AZ:https://t.co/PVB6QX7VpK https://t.co/2ToWwthEeF,06-16-2016 20:38:38,3479,9690,FALSE,7.44E+17
Twitter for iPhone,Thank you Dallas Texas! https://t.co/ui9tSfMcS8 https://t.co/2iYArmM7oN,06-17-2016 02:16:21,4228,14861,FALSE,7.44E+17
Twitter for Android,Amazing crowd last night in Dallas - more spirit and passion than ever before. Today all over the great State of Texas!,06-17-2016 11:04:58,4739,19314,FALSE,7.44E+17
Twitter for Android,People very unhappy with Crooked Hillary and Obama on JOBS and SAFETY! Biggest trade deficit in many years! More attacks will follow Orlando,06-17-2016 11:20:36,7217,22792,FALSE,7.44E+17
Twitter for Android,MAKE AMERICA GREAT AGAIN! MAKE AMERICA SAFE AGAIN!,06-17-2016 11:24:04,15812,38418,FALSE,7.44E+17
Twitter for iPhone,RT @robertjeffress: Honored to pray for my friend @realDonaldTrump at tonight's Dallas rally. #TrumpDallas c: @DanScavino https://t.co/Bc…,06-17-2016 15:27:37,4441,0,TRUE,7.44E+17
Twitter for iPhone,THANK YOU! #AmericaFirst https://t.co/qp07UfnnjM,06-17-2016 17:07:23,4436,13789,FALSE,7.44E+17
Twitter for iPhone,Join me in Phoenix Arizona tomorrow at 4pm! #Trump2016 #AmericaFirsthttps://t.co/PVB6QX7VpK https://t.co/B51r30Mazd,06-17-2016 21:14:59,3727,11950,FALSE,7.44E+17
Twitter for iPhone,Thank you @DallasPD!  https://t.co/ORJyN4FsNI,06-17-2016 23:24:13,2670,9334,FALSE,7.44E+17
Twitter for iPhone,Thank you- on my way!  https://t.co/uTCXPbWpve,06-17-2016 23:51:43,2647,9287,FALSE,7.44E+17
Twitter for iPhone,The convention in Cleveland will be amazing!  https://t.co/NlF2Gcr915,06-17-2016 23:55:29,3356,10281,FALSE,7.44E+17
Twitter for iPhone,Thank you! #AmericaFirst  https://t.co/TZf8uwQO4L,06-17-2016 23:56:54,3173,10483,FALSE,7.44E+17
Twitter for iPhone,Thank you Houston Texas! #AmericaFirst #Trump2016 https://t.co/593p8uRPhq,06-18-2016 02:44:21,3398,12578,FALSE,7.44E+17
Twitter for iPhone,Join me in Phoenix Arizona today at 4pm! #Trump2016 #AmericaFirst https://t.co/PVB6QX7VpK https://t.co/hSaIurAfvD,06-18-2016 17:22:31,2762,9693,FALSE,7.44E+17
Twitter for Android,In Las Vegas getting ready to speak!,06-18-2016 17:51:08,2566,12739,FALSE,7.44E+17
Twitter for iPhone,Thank you Las Vegas Nevada!#Trump2016 #AmericaFirst https://t.co/vhGwmhGCVR https://t.co/m1EIra7YMU,06-18-2016 19:39:17,3535,11703,FALSE,7.44E+17
Twitter for iPhone,MAKE AMERICA GREAT AGAIN! MAKE AMERICA SAFE AGAIN!#Trump2016 #AmericaFirst https://t.co/vN4K8FvQNT,06-18-2016 20:08:18,7074,19187,FALSE,7.44E+17
Twitter for iPhone,I love you Arizona! Thank you!#Trump2016 #AmericaFirst https://t.co/QuTsSmeVdO,06-19-2016 01:10:55,5019,16034,FALSE,7.44E+17
Twitter for iPhone,See you soon Arizona! #Trump2016 https://t.co/W4z2eW5ay4,06-19-2016 01:28:32,3621,12814,FALSE,7.44E+17
Twitter for iPhone,Donald Trump's Speech Is a Game Changer. #Trump2016https://t.co/VXjtSivvuU https://t.co/dIK3IyrYGC,06-19-2016 02:24:56,4874,14024,FALSE,7.44E+17
Twitter for iPhone,How can the NY Times show an empty room hours before my speech even started when they knew it was going to be packed? So totally dishonest!,06-19-2016 02:57:51,7633,25568,FALSE,7.44E+17
Twitter for iPhone,Yesterday's failing @NYTimes fraudulently shows an empty room prior to my speech when in fact it was packed! https://t.co/iFuf8MdTEH,06-19-2016 03:01:15,10415,26933,FALSE,7.44E+17
Twitter for Android,.@DJohnsonPGA We are so proud of you Dustin. Your reaction under pressure was amazing. First of many Majors. You are a true CHAMPION!,06-20-2016 01:22:16,5605,21147,FALSE,7.45E+17
Twitter for Android,When I said that if within the Orlando club you had some people with guns I was obviously talking about additional guards or employees,06-20-2016 10:24:12,7746,29927,FALSE,7.45E+17
Twitter for Android,Crooked Hillary Clinton is totally unfit to be our president-really bad judgement and a temperament according to new book which is a mess!,06-21-2016 10:38:49,8321,25049,FALSE,7.45E+17
Twitter Web Client,I will be making a big speech tomorrow to discuss the failed policies and bad judgment of Crooked Hillary Clinton.,06-21-2016 14:22:08,9144,27444,FALSE,7.45E+17
Twitter Web Client,Hillary says this election is about judgment.  She's right.  Her judgement has killed thousands unleashed ISIS and wrecked the economy.,06-21-2016 16:36:40,17080,39623,FALSE,7.45E+17
Twitter Web Client,Hillary Clinton surged the trade deficit with China 40% asSecretary of State costing Americans millions of jobs.,06-21-2016 16:38:07,7023,17896,FALSE,7.45E+17
Twitter Web Client,How can Hillary run the economy when she can't even send emails without putting entire nation at risk?,06-21-2016 16:42:47,19058,39918,FALSE,7.45E+17
Twitter for iPhone,Hillary Clinton's open borders immigration policies will drive down wages for all Americans - and make everyone less safe.,06-21-2016 16:44:28,8920,22799,FALSE,7.45E+17
Instagram,Obama-Clinton inherited $10T in debt and turned it into nearly $20T.  They have bankrupted… https://t.co/1COtt0RPY7,06-21-2016 16:53:07,6477,15008,FALSE,7.45E+17
Twitter for Android,"I am ""the king of debt.""That has been great for me as a businessman but is bad for the country. I made a fortune off of debt will fix U.S.",06-21-2016 16:55:41,6269,19867,FALSE,7.45E+17
Twitter Web Client,Hillary took money and did favors for regimes that enslave women and murder gays.,06-21-2016 17:16:14,14212,29053,FALSE,7.45E+17
Twitter Web Client,If you want to know about Hillary Clinton's honesty &amp; judgment ask the family of Ambassador Stevens.,06-21-2016 17:17:49,11728,25484,FALSE,7.45E+17
Twitter Web Client,Hillary defrauded America as Secy of State. She used it as a personal hedge fund to get herself rich! Corrupt dangerous dishonest.,06-21-2016 17:19:22,13647,32819,FALSE,7.45E+17
Twitter Web Client,I will be interviewed by @LouDobbs tonight on @FoxBusiness 7pm ET,06-21-2016 20:44:00,3116,11031,FALSE,7.45E+17
Twitter for Android,Crooked Hillary refuses to say that she will be raising taxes beyond belief! She will be a disaster for jobs and the economy!,06-22-2016 03:16:27,9776,28348,FALSE,7.45E+17
Twitter Web Client,Hillary says things can't change. I say they have to change. It's a choice between Americanism and her corrupt globalism. #Imwithyou,06-22-2016 19:00:47,13763,33197,FALSE,7.46E+17
Twitter for iPhone,#Imwithyou https://t.co/iY4K7Wcw3C,06-22-2016 19:01:09,12835,27766,FALSE,7.46E+17
Twitter Web Client,#Imwithyou https://t.co/tan8BmAuR8 https://t.co/5EZ7X1ZZKh,06-22-2016 21:39:43,6385,15095,FALSE,7.46E+17
Twitter for Android,"Thank you to Donald Rumsfeld for the endorsement. Very much appreciated. Clinton's conduct has been ""disqualifying.""",06-23-2016 13:13:22,5908,19957,FALSE,7.46E+17
Twitter for Android,Hillary Clinton may be the most corrupt person ever to seek the presidency.  --   Donald J. Trump,06-23-2016 13:17:35,9800,25758,FALSE,7.46E+17
Twitter for Android,"ISIS threatens us today because of the decisions Hillary Clinton has made along with President Obama.""  --  Donald J. Trump",06-23-2016 13:20:29,9216,25041,FALSE,7.46E+17
Twitter for iPhone,Hillary Lies to Benghazi Families#CrookedHillary https://t.co/YWd5lk5skG,06-23-2016 17:07:28,5213,12148,FALSE,7.46E+17
Twitter Web Client,"RT @FoxBusiness: .@JerryJrFalwell: ""I was so impressed by [@realDonaldTrump's] speech yesterday. He was the best I've ever seen him."" https…",06-23-2016 17:43:17,3852,0,TRUE,7.46E+17
Twitter Web Client,SC has kept us safe from exec amnesty--for now. But Hillary has pledged to expand it taking jobs from Hispanic &amp; African-American workers.,06-23-2016 18:07:46,4951,12774,FALSE,7.46E+17
Twitter Web Client,Hillary Clinton’s open borders are tearing American families apart. I am going to make our country Safe Again for all Americans. #Imwithyou,06-23-2016 18:18:18,6619,20173,FALSE,7.46E+17
Twitter Web Client,Obama &amp; Clinton should stop meeting with special interests &amp; start meeting with the victims of illegal immigration.,06-23-2016 18:30:08,7275,18827,FALSE,7.46E+17
Twitter Web Client,On immigration I’m consulting with our immigration officers&amp; our wage-earners. Hillary Clinton is consulting with Wall Street.,06-23-2016 18:48:20,6673,18489,FALSE,7.46E+17
Twitter Web Client,Our inner cities have been left behind. We will never have the resources to support our people if we have an open border.,06-23-2016 19:10:45,5868,15906,FALSE,7.46E+17
Twitter Web Client,RT @ScottAdamsSays: Trump's speech today is the best persuasion I have ever seen. Game over. Now running unopposed:  https://t.co/P7fHEMP6U…,06-23-2016 19:18:26,5483,0,TRUE,7.46E+17
Twitter Web Client,CNN which is totally biased in favor of Clinton should apologize. They knew they were wrong.  https://t.co/KR7OnS8h6s,06-23-2016 19:34:35,6169,13021,FALSE,7.46E+17
Twitter Web Client,Here is another CNN lie. The Clinton News Network is losing all credibility. I’m not watching it much anymore.  https://t.co/pNSgSjD5gW,06-23-2016 19:35:45,6769,14504,FALSE,7.46E+17
Twitter Web Client,Read my full statement here on the Supreme Court's executive amnesty decision #imwithyou https://t.co/sb1Ag1Eb27,06-23-2016 20:08:38,4646,10785,FALSE,7.46E+17
Twitter Web Client,Meet the amazing mother whose letter I read during my speech. She lost her son to policies supported by Clinton. https://t.co/NdGQI6Dnji,06-23-2016 21:36:06,6775,14471,FALSE,7.46E+17
Twitter for Android,Leaving now for a one night trip to Scotland in order to be at the Grand Opening of my great Turnberry Resort. Will be back on Sat. night!,06-24-2016 00:52:53,4030,18364,FALSE,7.46E+17
Twitter for Android,Congratulations to my son Eric on the fantastic job he has done in rebuilding Turnberry and its great Ailsa Course. Always support kids!,06-24-2016 00:58:06,5187,23976,FALSE,7.46E+17
Twitter for Android,Just arrived in Scotland. Place is going wild over the vote. They took their country back just like we will take America back. No games!,06-24-2016 09:21:55,17702,48397,FALSE,7.46E+17
Twitter for iPhone,Statement Regarding British Referendum on E.U. Membershiphttps://t.co/GwWRxT3BVp,06-24-2016 09:28:49,4189,10412,FALSE,7.46E+17
Twitter for Android,Getting ready to open the magnificent Turnberry in Scotland. What a great day especially when added to the brave &amp; brilliant vote.,06-24-2016 09:28:54,4574,17298,FALSE,7.46E+17
Twitter for iPhone,Self-determination is the sacred right of all free people's and the people of the UK have exercised that right for all the world to see.,06-24-2016 10:30:31,13130,31099,FALSE,7.46E+17
Twitter for iPhone,America is proud to stand shoulder-to-shoulder w/a free &amp; ind UK. We stand together as friends as allies &amp; as a people w/a shared history.,06-24-2016 10:32:00,15702,39898,FALSE,7.46E+17
Twitter for iPhone,New Government data by the Center for Immigration Studies shows more than 3M new legal &amp; illegal immigrants settled..https://t.co/hMFyZc1kAM,06-24-2016 18:48:50,4054,9713,FALSE,7.46E+17
Twitter for iPhone,I want all Americans to succeed together. President Obama's illegal executive amnesty undermines job prospects for...https://t.co/dpIDejXzJw,06-24-2016 18:50:57,5384,14611,FALSE,7.46E+17
Twitter for Android,Crooked Hillary called it totally wrong on BREXIT - she went with Obama - and now she is saying we need her to lead. She would be a disaster,06-24-2016 21:23:40,10322,29757,FALSE,7.46E+17
Twitter for Android,The opening of Trump Turnberry in Scotland was a big success. Good timing I was here for BREXIT. Very exciting news conference today!,06-24-2016 21:34:48,4095,16453,FALSE,7.46E+17
Twitter for Android,Many people are equating BREXIT and what is going on in Great Britain with what is happening in the U.S. People want their country back!,06-24-2016 21:43:17,10088,28751,FALSE,7.46E+17
Twitter for iPhone,Thoughts and prayers are with everyone in West Virginia- dealing with the devastating floods. #ImWithYou,06-25-2016 04:29:41,9059,27404,FALSE,7.47E+17
Twitter for Android,So funny Crooked Hillary called BREXIT so incorrectly and now she says that she is the one to deal with the U.K. All talk no action!,06-25-2016 12:00:29,8557,26532,FALSE,7.47E+17
Twitter for iPhone,Arriving @TrumpScotland with @DonaldJTrumpJr &amp; @EricTrump. Back to New York tonight. Video: https://t.co/2GUKqOTHS5,06-25-2016 14:55:11,1978,8328,FALSE,7.47E+17
Twitter for iPhone,On the 13th tee box @TrumpScotland with my grand daughter Kai! @DonaldJTrumpJr https://t.co/7ii4KUfsab,06-25-2016 15:07:32,2202,9776,FALSE,7.47E+17
Twitter for iPhone,Thank you to everyone who came out &amp; joined us @TrumpTurnberry yesterday! @EricTrump @IvankaTrump @DonaldJTrumpJr https://t.co/hQ1JTMrUtG,06-25-2016 16:00:18,3947,14650,FALSE,7.47E+17
Twitter for iPhone,We must suspend immigration from regions linked with terrorism until a proven vetting method is in place.,06-26-2016 02:37:14,11726,34613,FALSE,7.47E+17
Twitter for iPhone,We only want to admit those who love our people and support our values. #AmericaFirst,06-26-2016 02:37:59,8342,23846,FALSE,7.47E+17
Twitter for iPhone,I have never liked the media term 'mass deportation' -- but we must enforce the laws of the land!,06-26-2016 02:39:23,6731,22301,FALSE,7.47E+17
Twitter for iPhone,Obama has blocked ICE officers and BP from doing their jobs. That ends when I am President!,06-26-2016 02:40:06,8185,23629,FALSE,7.47E+17
Twitter for Android,Just landed in New York - a one night stay in Scotland. Turnberry came out magnificently. My son Eric did a great job - under budget!,06-26-2016 03:32:05,4705,21501,FALSE,7.47E+17
Twitter for Android,George Will one of the most overrated political pundits (who lost his way long ago) has left the Republican Party.He's made many bad calls,06-26-2016 11:24:00,5327,18529,FALSE,7.47E+17
Twitter for Android,Crooked Hillary Clinton who called BREXIT 100% wrong (along with Obama) is now spending Wall Street money on an ad on my correct call.,06-26-2016 11:33:17,7555,21727,FALSE,7.47E+17
Twitter for Android,Clinton is trying to wash away her bad judgement call on BREXIT with big dollar ads. Disgraceful!,06-26-2016 11:36:14,6341,18338,FALSE,7.47E+17
Twitter for Android,Crooked Hillary just took a major ad of me playing golf at Turnberry. Shows me hitting shot but I never did = lie! Was there to support son,06-26-2016 16:06:23,7150,20819,FALSE,7.47E+17
Twitter for Android,The @ABC poll sample is heavy on Democrats.  Very dishonest - why would they do that? Other polls good!,06-26-2016 16:21:15,4622,14059,FALSE,7.47E+17
Twitter for iPhone,Top 50 Facts About Crooked Hillary Clinton From Trump 'Stakes Of The Election' Address: https://t.co/lfUdXYnsgJ,06-26-2016 16:31:38,6026,12279,FALSE,7.47E+17
Twitter for Android,People in our country want borders and without them the old line pols like Crooked Hillary will not win. It is time for CHANGE -- and JOBS!,06-26-2016 21:21:50,6651,20728,FALSE,7.47E+17
Twitter for Android,Hillary Clinton is not a change agent just the same old status quo! She is spending a fortune I am spending very little. Close in polls!,06-26-2016 22:09:30,5846,18633,FALSE,7.47E+17
Twitter for Android,Crooked Hillary Clinton got Brexit wrong. I said LEAVE will win. She has no sense of markets and such bad judgement. Only a question of time,06-26-2016 22:15:40,5482,17418,FALSE,7.47E+17
Twitter for iPhone,Crooked Hillary Attacks Foreign Government Donations - While Ignoring Her Own: https://t.co/pr3BSHJSxL,06-26-2016 22:28:32,4306,11008,FALSE,7.47E+17
Twitter for Android,"The ""dirty"" poll done by @ABC @washingtonpost is a disgrace. Even they admit that many more Democrats were polled. Other polls were good.",06-26-2016 23:13:25,5143,15087,FALSE,7.47E+17
Twitter for Android,Crooked Hillary is wheeling out one of the least productive senators in the U.S. Senate goofy Elizabeth Warren who lied on heritage.,06-27-2016 13:07:04,8150,25696,FALSE,7.47E+17
Twitter for Android,The media is unrelenting. They will only go with and report a story in a negative light. I called Brexit (Hillary was wrong) watch November,06-27-2016 13:18:12,6845,21912,FALSE,7.47E+17
Twitter for Android,.@CNN is all negative when it comes to me. I don't watch it anymore.,06-27-2016 13:39:12,7081,23587,FALSE,7.47E+17
Twitter for iPhone,Check it out - 2nd video on Lying Crooked Hillary is now online! Watch it here: https://t.co/5mtwkOvQnd #CrookedHillary #Trump2016,06-28-2016 19:30:35,5110,10908,FALSE,7.48E+17
Twitter Web Client,Benghazi is just another Hillary Clinton failure. It justnever seems to work the way it's supposed to with Clinton.,06-28-2016 20:24:13,7948,23599,FALSE,7.48E+17
Twitter Web Client,Hillary Clinton’s Presidency would be catastrophic forthe future of our country. She is ill-fit with bad judgment.,06-28-2016 20:26:22,9247,25963,FALSE,7.48E+17
Twitter Web Client,Yet another terrorist attack this time in Turkey. Willthe world ever realize what is going on? So sad.,06-28-2016 21:08:51,12370,32152,FALSE,7.48E+17
Twitter Web Client,We must do everything possible to keep this horrible terrorism outside the United States.,06-28-2016 21:10:57,14039,38153,FALSE,7.48E+17
Twitter for Android,Iron Mike Tyson was not asked to speak at the Convention though I'm sure he would do a good job if he was. The media makes everything up!,06-29-2016 02:55:50,5482,19327,FALSE,7.48E+17
Twitter for Android,The @USCHAMBER must fight harder for the American worker. China and many others are taking advantage of U.S. with our terrible trade pacts,06-29-2016 13:09:49,4326,13405,FALSE,7.48E+17
Twitter for Android,Why would the USChamber be upset by the fact that I want to negotiate better and stronger trade deals or that I want penalties for cheaters?,06-29-2016 13:14:56,6423,19023,FALSE,7.48E+17
Twitter for Android,Just watched Senator John Barrasso on @FoxNews - He was great! Thank you John.,06-29-2016 14:37:37,2654,9861,FALSE,7.48E+17
Twitter for iPhone,New Q poll out- we are going to win the whole deal- and MAKE AMERICA GREAT AGAIN! #Trump2016 https://t.co/dL5ahNcwZb,06-29-2016 14:39:13,6670,21043,FALSE,7.48E+17
Twitter for iPhone,Will be in Bangor Maine today! Join me- 4pmE at the Cross Insurance Center! https://t.co/y4n4nERPFr https://t.co/7LAPewxE05,06-29-2016 14:48:24,2734,9561,FALSE,7.48E+17
Twitter for iPhone,ISIS exploded on Hillary Clinton's watch- she's done nothing about it and never will. Not capable!,06-29-2016 18:21:38,10032,26613,FALSE,7.48E+17
